<?xml version="1.0" encoding="UTF-8"?>
<ConceptElementMapping xmlns:xsi="http://www.w3.org/2001/XMLSchema-instance" xsi:noNamespaceSchemaLocation="fachbegriff_element_mapping_v0.1.xsd">
	<decisionId>BD0010_001</decisionId>
	<ConceptElement>
		<businessObject>Versand</businessObject>
		<factTypeName>Versandart-Fragebogen</factTypeName>
		<variableName>VERSAND_ART_CDOMS_FRAGEBOGEN</variableName>
		<businessConcept>Versand</businessConcept>
		<attributeName>vsndArtCdomsFrgbgn</attributeName>
		<domainKey>SMALLINT</domainKey>
		<CodeNaming>
			<code>1</code>
			<naming>eMail</naming>
		</CodeNaming>
		<CodeNaming>
			<code>2</code>
			<naming>Post</naming>
		</CodeNaming>
		<CodeNaming>
			<code>3</code>
			<naming>persönlich</naming>
		</CodeNaming>
	</ConceptElement>
	<ConceptElement>
		<businessObject>Fragebogen</businessObject>
		<factTypeName>Liste Interview-Frage</factTypeName>
		<variableName>ARRAY_INTERVIEW_FRAGE</variableName>
		<businessConcept>Fragebogen</businessConcept>
		<attributeName>intervFrage</attributeName>
		<domainKey>SMALLINT</domainKey>
	</ConceptElement>
	<ConceptElement>
		<businessObject>Person</businessObject>
		<factTypeName>Beruf</factTypeName>
		<variableName>BERUF_CDGPD</variableName>
		<businessConcept>Person</businessConcept>
		<attributeName>brufCdgpd</attributeName>
		<domainKey>SMALLINT</domainKey>
		<CodeNaming>
			<code>1</code>
			<naming>Consultant</naming>
		</CodeNaming>
		<CodeNaming>
			<code>2</code>
			<naming>Controller</naming>
		</CodeNaming>
		<CodeNaming>
			<code>3</code>
			<naming>Gärtner</naming>
		</CodeNaming>
		<CodeNaming>
			<code>4</code>
			<naming>Handwerker</naming>
		</CodeNaming>
		<CodeNaming>
			<code>5</code>
			<naming>Verkäufer</naming>
		</CodeNaming>
		<CodeNaming>
			<code>6</code>
			<naming>Vertreter</naming>
		</CodeNaming>
	</ConceptElement>
</ConceptElementMapping>
