<?xml version="1.0" encoding="UTF-8"?>
<ConceptElementMapping xmlns:xsi="http://www.w3.org/2001/XMLSchema-instance" xsi:noNamespaceSchemaLocation="fachbegriff_element_mapping_v0.1.xsd">
	<decisionId>BD0007_001</decisionId>
	<ConceptElement>
		<businessObject>Kredit</businessObject>
		<factTypeName>Ausfallwahrscheinlichkeit</factTypeName>
		<variableName>AUSFALL_WAHRSCHEINLICHKEIT_CDKR</variableName>
		<businessConcept>Kredit</businessConcept>
		<attributeName>ausflWhrschktCdkr</attributeName>
		<domainKey>SMALLINT</domainKey>
		<CodeNaming>
			<code>1</code>
			<naming>hoch</naming>
		</CodeNaming>
		<CodeNaming>
			<code>2</code>
			<naming>mittel</naming>
		</CodeNaming>
		<CodeNaming>
			<code>3</code>
			<naming>gering</naming>
		</CodeNaming>
	</ConceptElement>
	<ConceptElement>
		<businessObject>Antragsteller</businessObject>
		<factTypeName>Beschäftigungssituation</factTypeName>
		<variableName>BESCHAEFTIGUNG_ZUSTAND_CDKR</variableName>
		<businessConcept>AntragSteller</businessConcept>
		<attributeName>bschaeftgZustCdkr</attributeName>
		<domainKey>SMALLINT</domainKey>
		<CodeNaming>
			<code>1</code>
			<naming>gut</naming>
		</CodeNaming>
		<CodeNaming>
			<code>2</code>
			<naming>mittel</naming>
		</CodeNaming>
		<CodeNaming>
			<code>3</code>
			<naming>schlecht</naming>
		</CodeNaming>
	</ConceptElement>
	<ConceptElement>
		<businessObject>Antragsteller</businessObject>
		<factTypeName>Kreditbelastung</factTypeName>
		<variableName>KREDIT_BELASTUNG_CDKR</variableName>
		<businessConcept>AntragSteller</businessConcept>
		<attributeName>krdtBlastgCdkr</attributeName>
		<domainKey>SMALLINT</domainKey>
		<CodeNaming>
			<code>1</code>
			<naming>hoch</naming>
		</CodeNaming>
		<CodeNaming>
			<code>2</code>
			<naming>mittel</naming>
		</CodeNaming>
		<CodeNaming>
			<code>3</code>
			<naming>gering</naming>
		</CodeNaming>
	</ConceptElement>
	<ConceptElement>
		<businessObject>Antragsteller</businessObject>
		<factTypeName>Hypothekenbelastung</factTypeName>
		<variableName>HYPOTHEK_BELASTUNG_CDKR</variableName>
		<businessConcept>AntragSteller</businessConcept>
		<attributeName>hyptkBlastgCdkr</attributeName>
		<domainKey>SMALLINT</domainKey>
		<CodeNaming>
			<code>1</code>
			<naming>hoch</naming>
		</CodeNaming>
		<CodeNaming>
			<code>2</code>
			<naming>gering</naming>
		</CodeNaming>
	</ConceptElement>
	<ConceptElement>
		<businessObject>Kreditbelastung</businessObject>
		<factTypeName>Studentenkredit</factTypeName>
		<variableName>STUDENT_KREDIT_HOEHE_CDKR</variableName>
		<businessConcept>KreditBelastung</businessConcept>
		<attributeName>studtKrdtHoeheCdkr</attributeName>
		<domainKey>SMALLINT</domainKey>
		<CodeNaming>
			<code>1</code>
			<naming>hoch</naming>
		</CodeNaming>
		<CodeNaming>
			<code>2</code>
			<naming>niedrig</naming>
		</CodeNaming>
	</ConceptElement>
	<ConceptElement>
		<businessObject>Kreditbelastung</businessObject>
		<factTypeName>Konsumkredit</factTypeName>
		<variableName>KONSUM_KREDIT_HOEHE_CDKR</variableName>
		<businessConcept>KreditBelastung</businessConcept>
		<attributeName>konsumKrdtHoeheCdkr</attributeName>
		<domainKey>SMALLINT</domainKey>
		<CodeNaming>
			<code>1</code>
			<naming>hoch</naming>
		</CodeNaming>
		<CodeNaming>
			<code>2</code>
			<naming>mittel</naming>
		</CodeNaming>		
		<CodeNaming>
			<code>3</code>
			<naming>niedrig</naming>
		</CodeNaming>
	</ConceptElement>
	<ConceptElement>
		<businessObject>Beschäftigungssitution</businessObject>
		<factTypeName>Anzahl Jahre aktueller Job</factTypeName>
		<variableName>ANZAHL_JAHR_IN_JOB_AKTUELL</variableName>
		<businessConcept>BeschaeftigungSituation</businessConcept>
		<attributeName>anzJahrJobAktl</attributeName>
		<domainKey>SMALLINT</domainKey>
	</ConceptElement>
	<ConceptElement>
		<businessObject>Beschäftigungssitution</businessObject>
		<factTypeName>Anzahl Jobs letzte 5 Jahre</factTypeName>
		<variableName>ANZAHL_JOB_IN_5_JAHR</variableName>
		<businessConcept>BeschaeftigungSituation</businessConcept>
		<attributeName>anzJobIn5Jahr</attributeName>
		<domainKey>SMALLINT</domainKey>
	</ConceptElement>
</ConceptElementMapping>
